Season,Sector,Category,Crop,QueryType,QueryText,KccAns,StateName,DistrictName,BlockName,CreatedOn,
RABI,AGRICULTURE,Pulses,Black Gram (urd bean),Seeds,Asking about Blackgram seeds availability,recommended for National Pulses Research Centre phone number:04322-296447,TAMILNADU,TIRUVANNAMALAI,CHEYYAR,2017-12-21T13:09:17.863,
RABI,AGRICULTURE,Pulses,Black Gram (urd bean),Varieties,Asking about Blackgram seeds availability,Recommended for National Pulses Research Centre phone number:04322-296447,TAMILNADU,TIRUVANNAMALAI,CHEYYAR,2017-12-21T13:12:24.673,
RABI,AGRICULTURE,Others,Others,Weather,Asking about Thiruvannamalai today weather Report,Recommended for Thiruvannamalai today weather Report : very Light Rain fall (0.1 – 2.4 mm),TAMILNADU,TIRUVANNAMALAI,CHETPUT,2017-12-21T13:13:18.483,
RABI,AGRICULTURE,Cereals,Paddy (Dhan),Nutrient Management,asking about top fertilizer management in paddy,Recommended for apply urea 25 kg + potash 15 kg + neem cake 5 kg + mn mixture 5 kg /ac on 25th and 45 day after transplanting,TAMILNADU,TIRUVANNAMALAI,VEMBAKKAM,2017-12-21T13:14:38.51,
RABI,AGRICULTURE,Pulses,Black Gram (urd bean),Seeds,Asking about seed rate for black gram,Recommended forblack gram seed rate at 8 kg/ac,TAMILNADU,TIRUVANNAMALAI,KALASAPAKKAM,2017-12-21T13:16:19.64,
RABI,AGRICULTURE,Others,Others,Weather,asking about Thiruvannamalai today weather Report,Recommended for Thiruvannamalai today weather Report : very Light Rain fall (0.1 – 2.4 mm),TAMILNADU,TIRUVANNAMALAI,CHETPUT,2017-12-21T13:17:28.37,
RABI,AGRICULTURE,Others,Others,Weather,Asking about Thiruvannamalai today weather Report,Recommended for Thiruvannamalai today weather Report : Light Rain fall (2.5 – 7.5 mm),TAMILNADU,TIRUVANNAMALAI,POLUR,2017-12-21T13:22:22.36,
RABI,AGRICULTURE,Others,Others,Weather,Asking about Weather report for Thiruvannamalai,Recommended for today have light rainfall.,TAMILNADU,TIRUVANNAMALAI,CHENGAM,2017-12-21T13:22:48.26,
RABI,AGRICULTURE,Others,Others,Weather,asking about weather detail for Thiruvannamalai dist,Recommended today have No rain,TAMILNADU,TIRUVANNAMALAI,POLUR,2017-12-21T13:22:55.193,
RABI,AGRICULTURE,Others,Others,Weather,Asking about Thiruvannamalai today weather Report,Recommended for Thiruvannamalai today weather Report : very Light Rain fall (0.1 – 2.4 mm),TAMILNADU,TIRUVANNAMALAI,KEELPENNATHUR,2017-12-21T13:24:19.16,
RABI,AGRICULTURE,Pulses,Black Gram (urd bean),Cultural Practices,Asking about Average yield for VBN 7 black gram variety,Recommended for Average yield for VBN 7 black gram variety at 392 kg/ac,TAMILNADU,TIRUVANNAMALAI,KALASAPAKKAM,2017-12-21T13:26:01.07,
RABI,AGRICULTURE,Others,Others,Weather,asking about Thiruvannamalai today weather Report,Recommended for Thiruvannamalai today weather Report : very Light Rain fall (0.1 – 2.4 mm),TAMILNADU,TIRUVANNAMALAI,ARANI,2017-12-21T13:32:17.373,
RABI,AGRICULTURE,Others,Others,Weather,Asking about Thiruvannamalai district rainfall information,Recommended for having light rain today,TAMILNADU,TIRUVANNAMALAI,POLUR,2017-12-21T15:18:20.71,
RABI,AGRICULTURE,Others,Others,Weather,Asking about Thiruvannamalai district rainfall information,Recommended for having light rain today,TAMILNADU,TIRUVANNAMALAI,CHEYYAR,2017-12-21T17:08:12.827,
RABI,AGRICULTURE,Others,Others,Weather,Asking about Thiruvannamalai today weather Report,Recommended for Thiruvannamalai today weather Report : very Light Rain fall (0.1 – 2.4 mm),TAMILNADU,TIRUVANNAMALAI,THANDRAMPET,2017-12-21T17:09:09.38,
RABI,AGRICULTURE,Cereals,Paddy (Dhan),Plant Protection,asking about earhead bug control in paddy,recommended for spray malathion 2ml/lit of water,TAMILNADU,TIRUVANNAMALAI,KEELPENNATHUR,2017-12-21T17:14:25.96,
RABI,AGRICULTURE,Oilseeds,Groundnut (pea nut/mung phalli),Nutrient Management,Asking about groundnut top dressing fertilizer management,Recommended for apply gypsum 100kg / acre,TAMILNADU,TIRUVANNAMALAI,PERNAMALLUR,2017-12-21T17:20:07.177,
RABI,AGRICULTURE,Cereals,Paddy (Dhan),Varieties,Asking about suitable paddy varieties for Navarai season,"Recommended for paddy varieties ADT 36, ADT 39, ASD 16, ASD 18, MDU 5, CO 47,CORH 3, ADT 43 and ADT (R) 45",TAMILNADU,TIRUVANNAMALAI,CHENGAM,2017-12-21T17:32:30.42,
RABI,AGRICULTURE,Others,Others,Weather,Asking about Thiruvannamalai district rainfall information,Recommended for having light rain today,TAMILNADU,TIRUVANNAMALAI,ARANI,2017-12-21T17:37:29.867,
RABI,AGRICULTURE,Others,Others,Weather,Asking about Thiruvannamalai today weather Report,Recommended for Thiruvannamalai today weather Report : very Light Rain fall (0.1 – 2.4 mm),TAMILNADU,TIRUVANNAMALAI,ARANI,2017-12-21T17:39:27.767,
RABI,AGRICULTURE,Cereals,Paddy (Dhan),Cultural Practices,asking about Navarai season paddy varieties,"recommended for ADT 36, ADT 37, ASD 16, ASD 18, MDU 5, CO 47,CORH 3",TAMILNADU,TIRUVANNAMALAI,CHENGAM,2017-12-21T17:41:17.437,
RABI,AGRICULTURE,Others,Others,Weather,Asking about Thiruvannamalai today weather Report,Recommended for Thiruvannamalai today weather Report : very Light Rain fall (0.1 – 2.4 mm),TAMILNADU,TIRUVANNAMALAI,ARANI,2017-12-21T17:54:32.39,
RABI,AGRICULTURE,Others,Others,Weather,Asking about Thiruvannamalai today weather Report,Recommended for Thiruvannamalai today weather Report : very Light Rain fall (0.1 – 2.4 mm),TAMILNADU,TIRUVANNAMALAI,CHETPUT,2017-12-21T17:55:43.137,
RABI,HORTICULTURE,Vegetables,Watermelon,Nutrient Management,Asking about foliar spray watermelon,Recommended for spray potassium nitrate 5 gram /litre of water.,TAMILNADU,TIRUVANNAMALAI,TIRUVANNAMALAI,2017-12-21T18:07:38.743,
RABI,AGRICULTURE,Others,Others,Weather,Asking about weather report for Kancheepuram district,Recommended for next three days having cloudy weather occurring .,TAMILNADU,TIRUVANNAMALAI,KALASAPAKKAM,2017-12-21T18:16:30.23,
RABI,AGRICULTURE,Others,Others,Weather,asking about thiruvannamalai weather report,recommended for today have cloudy weather,TAMILNADU,TIRUVANNAMALAI,PUDUPALAYAM,2017-12-21T18:17:18.367,
RABI,AGRICULTURE,Oilseeds,Groundnut (pea nut/mung phalli),Plant Protection,Asked about groundnut prevent soil born pathogen,recommended for apply pseudomonas 1kg + 25 kg fym / acre,TAMILNADU,TIRUVANNAMALAI,THURINJAPURAM,2017-12-21T18:30:25.853,
RABI,AGRICULTURE,Others,Others,Weather,Asked about weather report information,recommended for today and tommarrow cloudy weather and possibility of less rainfall,TAMILNADU,TIRUVANNAMALAI,THELLAR,2017-12-21T18:34:05.527,
RABI,AGRICULTURE,Cereals,Paddy (Dhan),Plant Protection,Asked about paddy bacterial leaf blight management,recommended for Spray Streptomycin sulphate + Tetracycline combination 120 g + Copper oxychloride 500/acre / 200 litre of water. If necessary repeat 15 days later.,TAMILNADU,TIRUVANNAMALAI,THELLAR,2017-12-21T18:34:13.2,
RABI,HORTICULTURE,Plantation Crops,Coconut,Nutrient Management,Asked about coconut nutrient deficiency management,recommended for apply Soil application of Soil application ofManganese sulphate MnSO4 @ 10kg/acre,TAMILNADU,TIRUVANNAMALAI,POLUR,2017-12-21T18:36:28.657,
RABI,AGRICULTURE,Cereals,Paddy (Dhan),Plant Protection,Asking about leaf folder in paddy,Recommended for spray chlorpyriphos 2ml + neem oil + teepol 1ml/lit of water,TAMILNADU,TIRUVANNAMALAI,KALASAPAKKAM,2017-12-21T18:39:21.41,
RABI,HORTICULTURE,Flowers,Tuberose,Nutrient Management,Asking about Increasing flower production in tuberose,Recommended for spray GA3 0.5 gram /10 litre of water,TAMILNADU,TIRUVANNAMALAI,KALASAPAKKAM,2017-12-21T18:40:56.267,
RABI,AGRICULTURE,Others,Others,Weather,Asking about Weather report for Thiruvannamalai,"""Recommended for today have light rainfall. 
""",TAMILNADU,TIRUVANNAMALAI,POLUR,2017-12-21T19:39:30.86,
RABI,AGRICULTURE,Cereals,Paddy (Dhan),Plant Protection,Asking about leaf blight in Paddy,Recommended for spray copper hydroxide 2 gram /litre of water.,TAMILNADU,TIRUVANNAMALAI,POLUR,2017-12-21T19:45:12.997,
RABI,HORTICULTURE,Vegetables,Brinjal,Plant Protection,asking about brinjal little leaf management,recommended for spray daimethoiate – 2 ml/ lit of water,TAMILNADU,TIRUVANNAMALAI,CHETPUT,2017-12-21T19:46:44.76,
RABI,HORTICULTURE,Vegetables,Lab Lab,Plant Protection,asking about lablab pod borer management,recommended for spray emamecktin benzoiate – 4 ml/ 10 lit of water,TAMILNADU,TIRUVANNAMALAI,CHENGAM,2017-12-21T19:48:06.1,
RABI,HORTICULTURE,Vegetables,Ridge Gourd,Plant Protection,Asked about ridge gourd downey mildew management,recommended for spray metalaxyl 2 gm / litre of water,TAMILNADU,TIRUVANNAMALAI,CHEYYAR,2017-12-21T19:52:22.39,
RABI,HORTICULTURE,Vegetables,Drum Stick,Nutrient Management,Asked about drumstick planting season and variety,"recommended for Planting is done during July – October , variety PKM 1, PKM 2 and KKM 1",TAMILNADU,TIRUVANNAMALAI,PUDUPALAYAM,2017-12-21T20:07:12.387,
RABI,HORTICULTURE,Vegetables,Watermelon,Nutrient Management,Asking about plant growth regulator for watermelon,Recommended for spray Ethral 2.5 ml /10 litre of water.,TAMILNADU,TIRUVANNAMALAI,VANDAVASI,2017-12-21T20:14:40.413,
RABI,HORTICULTURE,Vegetables,Watermelon,Plant Protection,asking about cut worm control in watermelon,recommended for spray profenophos 2 ml / lit of water,TAMILNADU,TIRUVANNAMALAI,KEELPENNATHUR,2017-12-21T20:15:38.253,
RABI,AGRICULTURE,Others,Others,Weather,asking about thiruvannamalai weather report,recommended for today have cloudy weather,TAMILNADU,TIRUVANNAMALAI,THANDRAMPET,2017-12-21T20:31:24.81,
RABI,AGRICULTURE,Others,Others,Weather,Asking about Weather report for Thiruvannamalai,Recommended for today have light rainfall.,TAMILNADU,TIRUVANNAMALAI,VANDAVASI,2017-12-21T20:34:30.217,
RABI,AGRICULTURE,Cereals,Paddy (Dhan),Cultural Practices,asking about Navarai season paddy varieties,"recommended for ADT 36, ADT 39, ASD 16, ASD 18, MDU 5, CO 47,CORH 3, ADT 43, ADT (R) 45",TAMILNADU,TIRUVANNAMALAI,CHENGAM,2017-12-21T20:38:21.643,
RABI,AGRICULTURE,Others,Others,Weather,Asking about Weather report for Thiruvannamalai,Recommended for today have light rainfall.,TAMILNADU,TIRUVANNAMALAI,CHEYYAR,2017-12-21T21:29:27.503,
RABI,AGRICULTURE,Others,Others,Weather,Asking about weather report for thiruvannamalai district,Recommended for today sky have cloudy weather and there is chances of light rain occurring,TAMILNADU,TIRUVANNAMALAI,THANDRAMPET,2017-12-22T06:31:16.007,
RABI,AGRICULTURE,Cereals,Paddy (Dhan),Nutrient Management,Asking about paddy fertilizer management,Recommended for apply ammonium sulphate 30kg / acre,TAMILNADU,TIRUVANNAMALAI,TIRUVANNAMALAI,2017-12-22T06:35:59.21,
RABI,HORTICULTURE,Flowers,Chrysanthemum,Plant Protection,asking about chrysanthimum root rot management,recommended for apply pseudomonas fluorescens - 1 kg/ 20 kg of FYM/acre,TAMILNADU,TIRUVANNAMALAI,CHEYYAR,2017-12-22T07:38:36.207,
RABI,AGRICULTURE,Others,Others,Weather,Asking about weather detail in tiruvannamalai,recommended for have light rain in tiruvannamalai,TAMILNADU,TIRUVANNAMALAI,PUDUPALAYAM,2017-12-22T07:43:48.453,
RABI,AGRICULTURE,Others,Others,Weather,Asking about weather detail in tiruvannamalai,recommended for have light rain in tiruvannamalai,TAMILNADU,TIRUVANNAMALAI,TIRUVANNAMALAI,2017-12-22T07:48:06.95,
RABI,HORTICULTURE,Plantation Crops,Coconut,Seeds and Planting Material,"asking about Coconut Research Station,Veppankulam contact number",recommended to contact 04373-260205/202534,TAMILNADU,TIRUVANNAMALAI,THURINJAPURAM,2017-12-22T08:10:19.687,
RABI,HORTICULTURE,Plantation Crops,Coconut,Seeds and Planting Material,"Asking about Coconut Research Station,Aliyar Nagar contact number",Recommended to contact 04253-288722,TAMILNADU,TIRUVANNAMALAI,THURINJAPURAM,2017-12-22T08:11:04.643,
RABI,AGRICULTURE,Others,Others,Weather,Asking about paddy sowing season and varieties,"Recommended for paddy sowing season Navarai(Dec - Jan) and varieties ADT 36, ASD 16, ASD 18, MDU 5, CO 47,CORH 3",TAMILNADU,TIRUVANNAMALAI,POLUR,2017-12-22T08:22:05.65,
RABI,AGRICULTURE,Cereals,Paddy (Dhan),Nutrient Management,asking about zinc deficiency in paddy,Recommended for apply zinc sulphate 5gm / liter of water,TAMILNADU,TIRUVANNAMALAI,POLUR,2017-12-22T08:38:49.547,
RABI,AGRICULTURE,Cereals,Paddy (Dhan),Fertilizer Use and Availability,Asking about paddy top dressing fertilizer management,Recommended for apply urea 25 kg + potash 15 kg + neem cake 5 kg / acre,TAMILNADU,TIRUVANNAMALAI,THANDRAMPET,2017-12-22T09:13:55.25,
RABI,HORTICULTURE,Flowers,Rose,Plant Protection,Asking about sucking pests management in rose,Recommended for dimethoate 2 ml /1 litre of water,TAMILNADU,TIRUVANNAMALAI,KEELPENNATHUR,2017-12-22T09:20:02.073,
RABI,AGRICULTURE,Others,Others,Weather,Thiruvannamalai today weather Report,Recommended for Thiruvannamalai Today No Rain Fall (0.0 mm),TAMILNADU,TIRUVANNAMALAI,CHETPUT,2017-12-22T09:50:03.893,
RABI,AGRICULTURE,Others,Others,Weather,Gram pod borer in black gram,Recommended for spray Emamectin benzoate 4 gm / 10 lit of water,TAMILNADU,TIRUVANNAMALAI,CHENGAM,2017-12-22T09:55:34.583,
RABI,HORTICULTURE,Flowers,Jasmine,Plant Protection,Asking about budworm management in jasmine,Recommended for profenophos 2 ml /1 litre of water,TAMILNADU,TIRUVANNAMALAI,CHENGAM,2017-12-22T09:55:41.257,
RABI,AGRICULTURE,Others,Others,Weather,Asking about Thiruvannamalai today weather Report,Recommended for Thiruvannamalai Today No Rain Fall (0.0 mm),TAMILNADU,TIRUVANNAMALAI,THANDRAMPET,2017-12-22T09:56:47.773,
RABI,AGRICULTURE,Others,Others,Weather,Asking about weather report for thiruvannamalai district,Recommended for next three days having cloudy weather occurring .,TAMILNADU,TIRUVANNAMALAI,THELLAR,2017-12-22T10:14:26.707,
RABI,HORTICULTURE,Vegetables,Onion,Nutrient Management,basal fertilizer management for onion,Recommended for apply FYM 10 ton + 25kg urea + super phosphate 145kg + potash 20kg / ac,TAMILNADU,TIRUVANNAMALAI,TIRUVANNAMALAI,2017-12-22T10:44:10.297,
RABI,AGRICULTURE,Cereals,Paddy (Dhan),Varieties,Asking about suitable varieties for paddy (December -January),"Recommended for ADT 36, ADT 39, ASD 16, ASD 18, MDU 5, CO 47,CORH 3, ADT 43, ADT (R) 45",TAMILNADU,TIRUVANNAMALAI,POLUR,2017-12-22T11:22:26.717,
RABI,AGRICULTURE,Others,Others,Market Information,asking about need for commodity prices,"recommended for contact with regulated market, chetthupet, phone: 04181-252207",TAMILNADU,TIRUVANNAMALAI,CHETPUT,2017-12-22T11:34:26.707,
RABI,AGRICULTURE,Oilseeds,Groundnut (pea nut/mung phalli),Plant Protection,Asking about Tobacco caterpillar in groundnut,Recommended for spray profenophos 2ml / litre of water,TAMILNADU,TIRUVANNAMALAI,ARANI,2017-12-22T11:37:41.74,
RABI,AGRICULTURE,Oilseeds,Groundnut (pea nut/mung phalli),Fertilizer Use and Availability,asking about groundnut top dressing fertilziers,recommended for apply gypsum - 75 kg + borox - 4 kg/ acre,TAMILNADU,TIRUVANNAMALAI,KEELPENNATHUR,2017-12-22T11:41:16.143,
RABI,HORTICULTURE,Vegetables,Brinjal,Plant Protection,Asking about Leaf caterpillar management in groundnut,Recommended for spray Chlorpyriphos 2 ml + neem oil 3 ml + sticking agent 1 ml / litre of water,TAMILNADU,TIRUVANNAMALAI,THANDRAMPET,2017-12-22T12:26:15.453,
RABI,AGRICULTURE,Others,Others,Market Information,asking about need for commodity prices,"recommended for contact with regulated market, chetthupet, phone: 04181-252207",TAMILNADU,TIRUVANNAMALAI,CHETPUT,2017-12-22T12:26:44.847,
RABI,AGRICULTURE,Cereals,Paddy (Dhan),Market Information,Asking about market price paddy,Recommended for thiruvanamalai market price paddy ADT 37 Rs.1207 1505/quintal,TAMILNADU,TIRUVANNAMALAI,CHETPUT,2017-12-22T12:39:23.883,
RABI,AGRICULTURE,Cereals,Paddy (Dhan),Fertilizer Use and Availability,Asking about Top dressing fertilizer management for paddy,Recommended for apply urea 25 kg + potash 15 kg + neem cake 10 kg /acre,TAMILNADU,TIRUVANNAMALAI,THANDRAMPET,2017-12-22T12:39:50.447,
RABI,AGRICULTURE,Sugar and Starch Crops,Sugarcane (Noble Cane),Cultural Practices,Asking about latest suitable sugarcane variety,Recommended for latest suitable sugarcane variety is CO 0212.,TAMILNADU,TIRUVANNAMALAI,CHENGAM,2017-12-22T13:03:02.587,
NA,AGRICULTURE,Others,Others,Weather,asking about thiruvannamalai weather report,recommended for today have cloudy weather,TAMILNADU,TIRUVANNAMALAI,TIRUVANNAMALAI,2017-12-22T13:08:00.25,
RABI,ANIMAL HUSBANDRY,Animal,POULTRY FARM,"Animal Production (Piggery, Goatery, Sheep Farming etc.)",Tiruvannamalai District Veterinary University Training and Research Centre contact number,Recommended for Tiruvannamalai District Veterinary University Training and Research Centre contact number phone :04175-253077,TAMILNADU,TIRUVANNAMALAI,VANDAVASI,2017-12-22T13:29:15.503,
NA,HORTICULTURE,Fruits,Banana,Plant Protection,asking about banana leaf blight management,recommended for spray carbendazim - 2 gm/ lit of water,TAMILNADU,TIRUVANNAMALAI,CHEYYAR,2017-12-22T13:34:42.673,
RABI,HORTICULTURE,Vegetables,Brinjal,Nutrient Management,Asking about brinjal top dressing fertilizer management,Recommended for apply urea 42kg / acre,TAMILNADU,TIRUVANNAMALAI,CHENGAM,2017-12-22T13:38:37.427,
RABI,AGRICULTURE,Others,Others,Government Schemes,"Asking about Centre of Excellence for Millets, Athiyandal contact number","Recommended for contact to Centre of Excellence for Millets,
Athiyandal, Thiruvannamalai-606 603. Phone number: 04175-298001",TAMILNADU,TIRUVANNAMALAI,THURINJAPURAM,2017-12-22T13:43:27.15,
RABI,AGRICULTURE,Others,Others,Weather,Asking about Thiruvannamalai today weather Report,Recommended for Thiruvannamalai Today No Rain Fall (0.0 mm),TAMILNADU,TIRUVANNAMALAI,CHENGAM,2017-12-22T13:48:49.933,
RABI,AGRICULTURE,Others,Others,Weather,Asking about thiruvanamalai today weather Report,Recommended for thiruvanamalai Today No Rain Fall (0.0 mm),TAMILNADU,TIRUVANNAMALAI,KALASAPAKKAM,2017-12-22T13:51:34.683,
RABI,HORTICULTURE,Flowers,Crossandra,Plant Protection,Asking Root rot in Crossandra,Recommended for Soil drenching with Copper oxychloride 2.5 gm / litre of water,TAMILNADU,TIRUVANNAMALAI,ARANI,2017-12-22T13:52:12.947,
RABI,AGRICULTURE,Cereals,Paddy (Dhan),Market Information,Asking about Market rate for paddy,Recommended for Market rate for paddy gingee ponni Rs 2683/quintal,TAMILNADU,TIRUVANNAMALAI,CHETPUT,2017-12-22T13:56:15.28,
RABI,AGRICULTURE,Oilseeds,Groundnut (pea nut/mung phalli),Plant Protection,Asking about aphid in groundnut,Recommended for spray Chlorpyrifos 2ml / liter of water,TAMILNADU,TIRUVANNAMALAI,PERNAMALLUR,2017-12-22T13:56:40.52,
RABI,AGRICULTURE,Others,Others,Weather,Asking about weather report for thiruvannamalai district,Recommended for next three days having cloudy weather .,TAMILNADU,TIRUVANNAMALAI,PUDUPALAYAM,2017-12-22T14:01:47.72,
RABI,AGRICULTURE,Others,Others,Weather,asking about thiruvannamalai weather report,recommended for today have cloudy weather,TAMILNADU,TIRUVANNAMALAI,CHETPUT,2017-12-22T14:04:41.45,
RABI,HORTICULTURE,Vegetables,Chillies,Plant Protection,asking about yellow muranai mite in chilli,recommended for spray omite (Propergite) 1.5ml+ teepol 0.5ml + neemoil 3ml/lit of water,TAMILNADU,TIRUVANNAMALAI,CHEYYAR,2017-12-22T14:34:13.02,
RABI,AGRICULTURE,Others,Others,Nutrient Management,groundnut top dressing fertilizer management,Recommended for apply gypsum 150kg / ac,TAMILNADU,TIRUVANNAMALAI,CHEYYAR,2017-12-22T14:55:41.367,
RABI,HORTICULTURE,Flowers,Tuberose,Plant Protection,Asking about Leaf blight in tuberose,Recommended for spray mancozeb 2gram / lit,TAMILNADU,TIRUVANNAMALAI,KALASAPAKKAM,2017-12-22T16:01:55.08,
RABI,AGRICULTURE,Others,Others,Agriculture Mechanization,Asking about Subsidy detail for Mini tractor,"Recommended to contact nearest agricultural engineering department, Thiruvannamalai",TAMILNADU,TIRUVANNAMALAI,KALASAPAKKAM,2017-12-22T16:19:07.78,
RABI,AGRICULTURE,Others,Others,Nutrient Management,Asked about Thiruvannamalai today weather Report,Recommended for Thiruvannamalai Today No Rain Fall (0.0 mm),TAMILNADU,TIRUVANNAMALAI,CHEYYAR,2017-12-22T17:34:43.39,
RABI,AGRICULTURE,Cereals,Paddy (Dhan),Plant Protection,Asked about leaf folder management in paddy,Recommended for spray Fipronil 1.5 ml/lit of water,TAMILNADU,TIRUVANNAMALAI,TIRUVANNAMALAI,2017-12-22T18:22:57.453,
RABI,AGRICULTURE,Cereals,Paddy (Dhan),Fertilizer Use and Availability,asking about paddy top dressing fertilizers,Recommended for apply urea 25 kg + potash 15 kg + neem cake 5 kg / ac,TAMILNADU,TIRUVANNAMALAI,TIRUVANNAMALAI,2017-12-22T18:36:40.323,
NA,AGRICULTURE,Pulses,Black Gram (urd bean),Sowing Time and Weather,Asking about black gram sowing season and variety,"Recommended for black gram sowing season : December – january and variety : VBN 3, VBN (Bg) 4, VBN(Bg) 5, VBN 6, Co 6, TMV 1",TAMILNADU,TIRUVANNAMALAI,CHENGAM,2017-12-22T18:38:31.94,
NA,AGRICULTURE,Others,Others,Weather,Asking about Thiruvannamalai today weather Report,Recommended for Thiruvannamalai Today No Rain Fall (0.0 mm),TAMILNADU,TIRUVANNAMALAI,ARANI,2017-12-22T18:45:32.707,
RABI,AGRICULTURE,Cereals,Paddy (Dhan),Plant Protection,asking about Green leaf hopper in paddy,Recommended for spray Dimethoate 2ml / litre of water,TAMILNADU,TIRUVANNAMALAI,TIRUVANNAMALAI,2017-12-22T18:52:29.243,
RABI,AGRICULTURE,Others,Others,Organic Farming,Asking about organic certification department contact,"Recommended for contact to 1424A, Thadagam Road, GCT Post, Coimbatore - 641 013. Tamilnadu. India. Phone : 0422-2435080",TAMILNADU,TIRUVANNAMALAI,CHEYYAR,2017-12-22T19:37:01.217,
RABI,AGRICULTURE,Oilseeds,Groundnut (pea nut/mung phalli),Nutrient Management,asking about groundnut top dressing fertilizer management,Recommended for apply gypsum 150kg / acre,TAMILNADU,TIRUVANNAMALAI,KALASAPAKKAM,2017-12-22T19:43:21.837,
RABI,HORTICULTURE,Vegetables,Watermelon,Plant Protection,Asking About Watermelon Sudden Wilt Management,"Recommended for Good soil drainage and thin plant density reduces the incidence of disease,Spray Mancozeb/ Copper Oxychloride at 2.5 g /lit of water .",TAMILNADU,TIRUVANNAMALAI,THURINJAPURAM,2017-12-22T19:43:41.877,
RABI,AGRICULTURE,Others,Others,Nutrient Management,Asked about Thiruvannamalai today weather Report,Recommended for Thiruvannamalai Today No Rain Fall (0.0 mm),TAMILNADU,TIRUVANNAMALAI,CHEYYAR,2017-12-22T19:58:04.877,
RABI,AGRICULTURE,Others,Others,Weather,Asking about Weather report for Thiruvannamalai district,"Recommended for Today and tomorrow having cloudy weather and Possibility of light Rainfall chances (Temperature will be31degree Celsius (°C), Precipitation Chances (10% ) , Humidity level will be (46% ) Wind speed 5 km / hr .(For further information Call toll free number India Meteorological Department 18001801717",TAMILNADU,TIRUVANNAMALAI,THURINJAPURAM,2017-12-22T19:58:43.95,
RABI,AGRICULTURE,Others,Others,Weather,asking about Thiruvannamalai district today weather Report,Recommended for Thiruvannamalai district Today No Rain Fall (0.0 mm),TAMILNADU,TIRUVANNAMALAI,POLUR,2017-12-22T20:04:14.327,
RABI,AGRICULTURE,Others,Others,Nutrient Management,Asked about Thiruvannamalai today weather Report,Recommended for Thiruvannamalai Today No Rain Fall (0.0 mm),TAMILNADU,TIRUVANNAMALAI,THELLAR,2017-12-22T20:11:47.91,
RABI,AGRICULTURE,Others,Others,Nutrient Management,Thiruvannamalai today weather Report,Recommended for Thiruvannamalai Today No Rain Fall (0.0 mm),TAMILNADU,TIRUVANNAMALAI,THELLAR,2017-12-22T20:16:30.153,
RABI,HORTICULTURE,Vegetables,Watermelon,Seeds and Planting Material,asking about watermelon sowing season and varieties,"Recommended for watermelon sowing season : november - December and varieties : Sugar Baby and Arka Manik, PKM 1, Hybrids : Arka Jyoti and Pusa Bedana.",TAMILNADU,TIRUVANNAMALAI,KALASAPAKKAM,2017-12-22T20:16:33.083,
RABI,AGRICULTURE,Others,Others,Weather,asking about Thiruvannamalai district today weather Report,Recommended for Thiruvannamalai district Today No Rain Fall (0.0 mm),TAMILNADU,TIRUVANNAMALAI,KALASAPAKKAM,2017-12-22T20:18:15.687,
RABI,AGRICULTURE,Cereals,Paddy (Dhan),Fertilizer Use and Availability,Asked about Top dressing fertilizer management for paddy,Recommended for apply urea 25 kg + potash 15 kg + neem cake 5 kg + Microfood 5 kg/ ac,TAMILNADU,TIRUVANNAMALAI,THURINJAPURAM,2017-12-22T20:58:40.947,
RABI,HORTICULTURE,Vegetables,Watermelon,Plant Protection,asking about stem blight control in watermelon,recommended for spray metalaxyl+mancozeb 2 g/lit of water,TAMILNADU,TIRUVANNAMALAI,THURINJAPURAM,2017-12-22T21:05:02.32,
RABI,AGRICULTURE,Oilseeds,Sesame (Gingelly/Til)/Sesamum,Sowing Time and Weather,Asking about sowing season for sesame,Recommended for sesame sowing season at February - March and June-July,TAMILNADU,TIRUVANNAMALAI,TIRUVANNAMALAI,2017-12-22T21:06:05.813,
RABI,AGRICULTURE,Others,Others,Weather,asking about tiruvannamalai weather report,recommended for today have a light rain day,TAMILNADU,TIRUVANNAMALAI,TIRUVANNAMALAI,2017-12-22T21:09:03.61,
RABI,AGRICULTURE,Others,Others,Weather,asking about tiruvannamalai weather report,recommended for today have a light rain day,TAMILNADU,TIRUVANNAMALAI,ARANI,2017-12-22T21:15:30.93,
RABI,AGRICULTURE,Others,Others,Weather,asking about maduranthagam weather report,recommended for today have cloudy weather,TAMILNADU,TIRUVANNAMALAI,KALASAPAKKAM,2017-12-22T21:20:21.287,
RABI,AGRICULTURE,Millets,FingerMillet (Ragi/Mandika),Cultural Practices,asking about ragi suitable season,recommended for Marghazipattam (Dec - Jan) suitable for sowing,TAMILNADU,TIRUVANNAMALAI,CHENGAM,2017-12-22T21:32:30.543,
RABI,HORTICULTURE,Vegetables,Brinjal,Cultural Practices,asking about Sowing season of brinjal,recommended for Sowing season of brinjal is December – January and May – June,TAMILNADU,TIRUVANNAMALAI,CHENGAM,2017-12-22T21:41:21.893,
RABI,AGRICULTURE,Others,Others,Weather,asking about Thiruvannamalai today weather Report,Recommended for Thiruvannamalai Today No Rain Fall (0.0 mm),TAMILNADU,TIRUVANNAMALAI,CHENGAM,2017-12-23T06:21:27.5,
