Season,Sector,Category,Crop,QueryType,QueryText,KccAns,StateName,DistrictName,BlockName,CreatedOn,
RABI,AGRICULTURE,Millets,Maize (Makka),Cultural Practices,Asking about Sowing season for maize crop,"Recommended for Adipattam (July - August),Purattasipattam (September - October) and Thaipattam (January - February)",TAMILNADU,TIRUVANNAMALAI,PUDUPALAYAM,2017-12-11T07:52:18.087,
RABI,HORTICULTURE,Vegetables,Brinjal,Plant Protection,Asking about Brinjal Shoot and fruit borer management,"Recommended for Cultivate inter crop cotton with Brinjal 4:2 Ratio and grow maize crop around the field, Install light traps for 1 per acre , Remove Affected plant parts , Spray BT solution 1 ml / lit of water at the time of flowering stage , Spray neem seeds kernel extract ( Make powder 0.5kg of neem kernels And tied with gunny bags and put in the Buckets which is contain 10 lit of water allowed it for extraction).",TAMILNADU,TIRUVANNAMALAI,THURINJAPURAM,2017-12-11T07:57:37.727,
RABI,AGRICULTURE,Cereals,Paddy (Dhan),Varieties,asking about varieties of paddy,"recommended varieties of paddy ADT 36, ADT 39, ASD 16, ASD 18, MDU 5, CO 47,CORH 3, ADT 43, ADT (R) 45",TAMILNADU,TIRUVANNAMALAI,KALASAPAKKAM,2017-12-11T08:12:15.083,
RABI,AGRICULTURE,Cereals,Paddy (Dhan),Varieties,Asking about Suitable paddy varieties for navarai season,"Recommended for ADT 36, ADT 39, ASD 16, ASD 18, MDU 5, CO 47,CORH 3, ADT 43, ADT (R) 45.",TAMILNADU,TIRUVANNAMALAI,KALASAPAKKAM,2017-12-11T08:20:44.563,
RABI,AGRICULTURE,Cereals,Paddy (Dhan),Plant Protection,asking about False Smut management in paddy,Recommended for spray of Propiconazole 2ml / litre of water,TAMILNADU,TIRUVANNAMALAI,TIRUVANNAMALAI,2017-12-11T08:25:35.87,
RABI,HORTICULTURE,Plantation Crops,Coconut,Seeds and Planting Material,asking about coconut seedlings availability information,"Recommended for Coconut Research Station, Veppankulam, Thanjavur contact no. 04373 - 260205, 04373 - 202534",TAMILNADU,TIRUVANNAMALAI,TIRUVANNAMALAI,2017-12-11T08:41:34.067,
RABI,AGRICULTURE,Fiber Crops,Cotton (Kapas),Cultural Practices,Asking about neem oil preparation,"Recommended for Spray Neem oil 3 ml + 1 ml Sticking Agent / Lit of water ( Dilute and mix well 10 ml of Sticking Agent and add 30 ml of neem oil / lit of water , Then it is added to 9 litter of Water And pour the Tank and It should be sprayed on crop .)",TAMILNADU,TIRUVANNAMALAI,POLUR,2017-12-11T09:02:14.457,
RABI,AGRICULTURE,Pulses,Black Gram (urd bean),Varieties,asking about black gram sowing season and varieties,"Recommended for black gram sowing season : Markazhi – Thaipattam y and varieties : VBN 3, VBN (Bg) 4, VBN(Bg) 5, VBN 6, Co 6, TMV 1",TAMILNADU,TIRUVANNAMALAI,KEELPENNATHUR,2017-12-11T09:12:49.99,
RABI,AGRICULTURE,Cereals,Paddy (Dhan),Plant Protection,Asked about paddy leaf folder management,recommended for spray Chlorpyriphos 2ml / litre of water,TAMILNADU,TIRUVANNAMALAI,TIRUVANNAMALAI,2017-12-11T09:39:39.18,
RABI,AGRICULTURE,Oilseeds,Groundnut (pea nut/mung phalli),Plant Protection,Asked about Groundnut leaf feeder management,recommended for spray Chlorpyriphos 2ml / litre of water,TAMILNADU,TIRUVANNAMALAI,TIRUVANNAMALAI,2017-12-11T09:42:33.5,
RABI,AGRICULTURE,Cereals,Paddy (Dhan),Fertilizer Use and Availability,asking about paddy top dressing fertilizer management,Recommended for apply urea 25 kg + potash 15 kg + neem cake 5 kg / acre,TAMILNADU,TIRUVANNAMALAI,ARANI,2017-12-11T09:56:59.9,
RABI,AGRICULTURE,Cereals,Paddy (Dhan),Nutrient Management,Asking about paddy fertilizer (MN) management,Recommended for apply micro mixture 5kg / ac,TAMILNADU,TIRUVANNAMALAI,CHENGAM,2017-12-11T09:58:01.62,
RABI,AGRICULTURE,Millets,FingerMillet (Ragi/Mandika),Varieties,Ragi sowing season and variety,"Recommmended for Ragi sowing season : December - January and variety : CO 9, CO 13, CO (Ra) 14 , TRY 1 9944429421",TAMILNADU,TIRUVANNAMALAI,TIRUVANNAMALAI,2017-12-11T09:59:32.117,
RABI,AGRICULTURE,Cereals,Paddy (Dhan),Plant Protection,Asking about Leaf folder management in paddy,Recommend for spray chlorpyriphos 2 ml + sticking agent 1 ml /litre of water,TAMILNADU,TIRUVANNAMALAI,ARANI,2017-12-11T10:03:30.323,
NA,AGRICULTURE,Cereals,Paddy (Dhan),Plant Protection,Asked about leaf folder management in paddy,Recommended for spray CartapHydrochloride 2 gram / lit of water,TAMILNADU,TIRUVANNAMALAI,VANDAVASI,2017-12-11T10:26:06.703,
RABI,HORTICULTURE,Flowers,Jasmine,Nutrient Management,Asking about jasmine growth regulator,Recommended for spray GA3 50ppm 5gm / 100lit of water,TAMILNADU,TIRUVANNAMALAI,THURINJAPURAM,2017-12-11T11:22:32.897,
RABI,HORTICULTURE,Flowers,Jasmine,Plant Protection,Asking about Jasmine Budworm Management,"Recommended for Collect and destroy the damaged buds with larvae , Use light trap to attract and kill the adult moths , Proper pruning and hygienic maintenance of bushes , spray Fipronil 5 % SC(Regent 5 SC (5% w/w) 1 .5 ml / lit of water",TAMILNADU,TIRUVANNAMALAI,CHENGAM,2017-12-11T11:41:11.85,
RABI,HORTICULTURE,Vegetables,Bhindi(Okra/Ladysfinger),Plant Protection,Asking about shoot and fruit borer in brinjal,Recommended for spray chloripyriphos 2ml / litre of water,TAMILNADU,TIRUVANNAMALAI,CHENGAM,2017-12-11T11:49:55.713,
RABI,AGRICULTURE,Others,Others,Weather,asking about Thiruvannamalai district today weather Report,Recommended for Thiruvannamalai district Today No Rain Fall (0.0 mm),TAMILNADU,TIRUVANNAMALAI,CHETPUT,2017-12-11T12:00:18.63,
RABI,AGRICULTURE,Cereals,Paddy (Dhan),Nutrient Management,askign about paddy top dressing fertilizer management,Recommended for apply urea 25 kg + potash 15 kg + neem cake 5 kg / acre,TAMILNADU,TIRUVANNAMALAI,CHETPUT,2017-12-11T12:01:39.11,
RABI,AGRICULTURE,Cereals,Paddy (Dhan),Plant Protection,Asking about False Smut in paddy,Recommended for spray of Propiconazole 1 ml / litre of water,TAMILNADU,TIRUVANNAMALAI,CHENGAM,2017-12-11T12:10:18.397,
RABI,AGRICULTURE,Cereals,Paddy (Dhan),Nutrient Management,asking about paddy basal fertilizer management,Recommended for apply DAP 50 kg + zinc sulphate 10 kg + neem cake 10kg + FYM 10ton / acre,TAMILNADU,TIRUVANNAMALAI,ARANI,2017-12-11T12:20:55.993,
NA,AGRICULTURE,Cereals,Paddy (Dhan),Plant Protection,Asking about Ear head bug in paddy,Recommended for spray malathion 2ml / liter of water,TAMILNADU,TIRUVANNAMALAI,KEELPENNATHUR,2017-12-11T12:21:00.647,
RABI,AGRICULTURE,Others,Others,Weather,asking about Thiruvannamalai district today weather Report,Recommended for Thiruvannamalai district Today No Rain Fall (0.0 mm),TAMILNADU,TIRUVANNAMALAI,CHEYYAR,2017-12-11T12:50:01.89,
RABI,AGRICULTURE,Cereals,Paddy (Dhan),Nutrient Management,Asking about paddy fertilizer (MN) management,Recommended for apply micro mixture 5kg / acre,TAMILNADU,TIRUVANNAMALAI,THELLAR,2017-12-11T12:50:28.693,
NA,AGRICULTURE,Cereals,Paddy (Dhan),Plant Protection,asking about False Smut management in paddy,Recommended for spray of Propiconazole 2ml / litre of water,TAMILNADU,TIRUVANNAMALAI,CHENGAM,2017-12-11T12:53:38.01,
NA,AGRICULTURE,Cereals,Paddy (Dhan),Plant Protection,asking about leaf roller in paddy,Recommended for spray CartapHydrochloride 2gm / litre of water,TAMILNADU,TIRUVANNAMALAI,CHEYYAR,2017-12-11T13:02:05.22,
RABI,AGRICULTURE,Others,Others,Weather,asking about Thiruvannamalai district today weather Report,Recommended for Thiruvannamalai district Today No Rain Fall (0.0 mm),TAMILNADU,TIRUVANNAMALAI,THELLAR,2017-12-11T13:40:19.81,
RABI,HORTICULTURE,Vegetables,Chillies,Seeds and Planting Material,asking about chilli sowing season and variety,"Recommended for chilli sowing season :January and variety : K 1, K 2, CO1, CO 2, CO 4, PKM 1, PLR 1, PMK 1, KKM (Ch) 1, Hybrid : Co 1",TAMILNADU,TIRUVANNAMALAI,KEELPENNATHUR,2017-12-11T13:49:34.023,
RABI,AGRICULTURE,Others,Others,Cultural Practices,Asking about intercrops in teak,"Recommended for black gram , cumbu, maize, green gram.",TAMILNADU,TIRUVANNAMALAI,CHETPUT,2017-12-11T13:55:35.86,
RABI,AGRICULTURE,Others,Others,Weather,Asked about Tiruvannamalai weather report information,recommended for today and tommarrow cloudy weather and no possibility of rainfall,TAMILNADU,TIRUVANNAMALAI,ARANI,2017-12-11T14:19:58.44,
RABI,AGRICULTURE,Others,Others,Government Schemes,Asking about govt schemes details,Recommended for contact to block level agriculture office,TAMILNADU,TIRUVANNAMALAI,POLUR,2017-12-11T14:21:59.72,
RABI,HORTICULTURE,Flowers,Rose,Seeds and Planting Material,Asked about rose planting season soil and climate,recommended for Well-drained sandy loam with pH of 6-7 is suitable Avoid planting in the middle of winter,TAMILNADU,TIRUVANNAMALAI,ARANI,2017-12-11T14:36:37.22,
RABI,AGRICULTURE,Others,Others,Weather,asking about Thiruvannamalai district today weather Report,Recommended for Thiruvannamalai district Today No Rain Fall (0.0 mm),TAMILNADU,TIRUVANNAMALAI,KALASAPAKKAM,2017-12-11T14:53:51.32,
RABI,AGRICULTURE,Cereals,Paddy (Dhan),Sowing Time and Weather,Asking about Paddy navarai season of planting and varieties for Vellore/Tiruvannamalai,"Recommended for Navarai(Dec -Jan)ADT 36, ADT 39, ASD 16, ASD 18, MDU 5, CO 47,CORH 3, ADT 43, ADT (R) 45",TAMILNADU,TIRUVANNAMALAI,KALASAPAKKAM,2017-12-11T14:54:58.56,
RABI,AGRICULTURE,Others,Others,Weather,asking about Thiruvannamalai district today weather Report,Recommended for Thiruvannamalai district Today No Rain Fall (0.0 mm),TAMILNADU,TIRUVANNAMALAI,ARANI,2017-12-11T15:00:47.177,
RABI,HORTICULTURE,Vegetables,Amaranthus/Grain Amaranthus,Nutrient Management,Asking about basal fertilizer management for Amaranthus,Recommended for apply + Fym 10 tone + urea 65 kg +potash 16.5 kg / ac,TAMILNADU,TIRUVANNAMALAI,VEMBAKKAM,2017-12-11T15:01:27.713,
RABI,HORTICULTURE,Condiments and Spices,Turmeric,Plant Protection,Asked about turmeric Leaf blotch management,recommended for Leaf spot controlled by spraying Carbendazim 100 gm/ acre + Mancozeb 200gm /acre,TAMILNADU,TIRUVANNAMALAI,CHENGAM,2017-12-11T15:30:58.05,
RABI,HORTICULTURE,Condiments and Spices,Turmeric,Nutrient Management,Asked about turmeric micronutrient foliar application,"recommended for 6 kg Super Phosphate is dissolved in 10 lit of water stored overnight and take the supernatant solution mixed with 150 gm each borax , zinch , ferrous and spray twice at 25 days interval",TAMILNADU,TIRUVANNAMALAI,CHENGAM,2017-12-11T15:38:30.023,
RABI,HORTICULTURE,Vegetables,Brinjal,Nutrient Management,Asking about brinjal foliar application,Recommended for brinjal foliar spray for 19:19:19 50 gm / tank,TAMILNADU,TIRUVANNAMALAI,CHETPUT,2017-12-11T15:43:25.497,
RABI,ANIMAL HUSBANDRY,Animal,"Bovine(Cow,Buffalo)",Livestock Products Processing and Packaging,Asking about Training detail for dairy farming,"Recommended to contact Krishi Vigyan Kendra, Kattankulathur Post, Kattupakkam, Kancheepuram- 603203. ph : 0442-7452371",TAMILNADU,TIRUVANNAMALAI,ARANI,2017-12-11T16:29:23.843,
RABI,AGRICULTURE,Oilseeds,Groundnut (pea nut/mung phalli),Fertilizer Use and Availability,asking about Top dressing fertilizer management for groundnut,recommended for apply 5.5 kg urea+12 kg potash 25 DAS/acre,TAMILNADU,TIRUVANNAMALAI,CHETPUT,2017-12-11T16:32:20.66,
RABI,HORTICULTURE,Fruits,Citrus,Plant Protection,Asking about Root rot in citrus,Recommended for soil apply Trichoderma viride 1kg + FYM 20kg / ac,TAMILNADU,TIRUVANNAMALAI,KEELPENNATHUR,2017-12-11T16:44:47.183,
RABI,HORTICULTURE,Fruits,Citrus,Nutrient Management,Asking about Root rot in citrus,Recommended for soil apply Trichoderma viride 1kg + FYM 20kg / ac,TAMILNADU,TIRUVANNAMALAI,KEELPENNATHUR,2017-12-11T16:47:05.42,
NA,AGRICULTURE,Oilseeds,Groundnut (pea nut/mung phalli),Nutrient Management,Asking about top fertilizer management for groundnut,Recommended for apply urea 4 kg + potash 8 kg /acre on 25th day after sowing,TAMILNADU,TIRUVANNAMALAI,POLUR,2017-12-11T17:00:19.94,
NA,HORTICULTURE,Vegetables,Brinjal,Plant Protection,Asking about Stem borer management in Brinjal,Recommended for spray profenophos 2ml/lit of water,TAMILNADU,TIRUVANNAMALAI,CHEYYAR,2017-12-11T17:00:42.807,
RABI,AGRICULTURE,Cereals,Paddy (Dhan),Cultural Practices,Asking about transplanting age for ADT 45 paddy variety,Recommended for ADT 45 paddy variety transplanting age at 18-22 days after sowing,TAMILNADU,TIRUVANNAMALAI,CHEYYAR,2017-12-11T17:16:44.067,
NA,HORTICULTURE,Vegetables,Watermelon,Seeds and Planting Material,asking about watermelon sowing season and variety,"Recommended for watermelon sowing season : november - December and variety : Sugar Baby and Arka Manik, PKM 1, Hybrids : Arka Jyoti and Pusa Bedana.",TAMILNADU,TIRUVANNAMALAI,THANDRAMPET,2017-12-11T17:29:24.92,
NA,AGRICULTURE,Cereals,Paddy (Dhan),Varieties,Asking about suitable paddy varieties for Navarai season,"Recommended for paddy varieties ADT 36, ADT 39, ASD 16, ASD 18, MDU 5, CO 47,CORH 3, ADT 43 and ADT (R) 45",TAMILNADU,TIRUVANNAMALAI,POLUR,2017-12-11T17:32:58.08,
RABI,AGRICULTURE,Fodder Crops,velimasal,Seeds,Asking about velimasal seed rate,Recommended for velimasal seed rate at 8 kg/ac,TAMILNADU,TIRUVANNAMALAI,CHEYYAR,2017-12-11T18:03:01.36,
RABI,AGRICULTURE,Others,Others,Weather,Asking about Weather report for Thiruvannamalai district,"Recommended for Today and tomorrow having cloudy weather and Possibility of light Rainfall chances (Temperature will be31degree Celsius (°C), Precipitation Chances (10% ) , Humidity level will be (46% ) Wind speed 5 km / hr .(For further information Call toll free number India Meteorological Department 18001801717",TAMILNADU,TIRUVANNAMALAI,CHEYYAR,2017-12-11T18:06:01.767,
RABI,AGRICULTURE,Pulses,Black Gram (urd bean),Nutrient Management,asking about blackgram TNAU foliar application,Recommended for spray pulses wonder 2kg / acre/ 200 litters of water,TAMILNADU,TIRUVANNAMALAI,THANDRAMPET,2017-12-11T18:17:56.237,
RABI,AGRICULTURE,Others,Others,Weather,asking about Thiruvannamalai district today weather Report,Recommended for Thiruvannamalai district Today No Rain Fall (0.0 mm),TAMILNADU,TIRUVANNAMALAI,CHENGAM,2017-12-11T18:38:58.44,
RABI,AGRICULTURE,Cereals,Paddy (Dhan),Varieties,Asking about suitable paddy season varieties,"Recommended for the season is Navarai (Dec -Jan) ADT 36, ADT 39, ASD 16, ASD 18, MDU 5, CO 47,CORH 3, ADT 43, ADT (R) 45",TAMILNADU,TIRUVANNAMALAI,CHENGAM,2017-12-11T18:44:27.143,
RABI,AGRICULTURE,Cereals,Paddy (Dhan),Varieties,Asking about suitable paddy varieties for Navarai season,"Recommended for paddy varieties ADT 36, ADT 39, ASD 16, ASD 18, MDU 5, CO 47,CORH 3, ADT 43 and ADT (R) 45",TAMILNADU,TIRUVANNAMALAI,ARANI,2017-12-11T18:49:50.06,
RABI,AGRICULTURE,Cereals,Paddy (Dhan),Plant Protection,asking about leaf folder management in paddy,Recommended for spray chlorpyrifos 2ml / litre of water,TAMILNADU,TIRUVANNAMALAI,KALASAPAKKAM,2017-12-11T18:56:11.267,
RABI,AGRICULTURE,Others,Others,Weather,Asking about Weather report for Thiruvannamalai district,"Recommended for Today and tomorrow having cloudy weather and Possibility of light Rainfall chances (Temperature will be31degree Celsius (°C), Precipitation Chances (10% ) , Humidity level will be (46% ) Wind speed 5 km / hr .(For further information Call toll free number India Meteorological Department 18001801717",TAMILNADU,TIRUVANNAMALAI,THANDRAMPET,2017-12-11T18:57:58.927,
RABI,AGRICULTURE,Others,Others,Weather,asking about weather report for Thiruvannamalai district,Recommended for weather report for Thiruvannamalai district Partly Cloudy and no rain fall,TAMILNADU,TIRUVANNAMALAI,POLUR,2017-12-11T19:01:29.583,
RABI,HORTICULTURE,Vegetables,Brinjal,Nutrient Management,Asking about Induce the flowering in brinjal,Recommended to spray Nitrobenzene 2ml/lit of water,TAMILNADU,TIRUVANNAMALAI,CHENGAM,2017-12-11T19:03:07.273,
RABI,AGRICULTURE,Cereals,Paddy (Dhan),Varieties,Asking about suitable paddy varieties for Navarai season,"Recommended for paddy varieties ADT 36, ADT 39, ASD 16, ASD 18, MDU 5, CO 47,CORH 3, ADT 43 and ADT (R) 45",TAMILNADU,TIRUVANNAMALAI,CHETPUT,2017-12-11T19:11:46.31,
RABI,HORTICULTURE,Vegetables,Brinjal,Market Information,asking about market price of brinjal,recommended for market price of brinjal is 30/kg,TAMILNADU,TIRUVANNAMALAI,KALASAPAKKAM,2017-12-11T19:13:17.96,
RABI,AGRICULTURE,Millets,FingerMillet (Ragi/Mandika),Nutrient Management,Asked about ragi basal fertilizer,"recommended for apply urea 28 kg ,super phosphate 75kg+ 19 kg potash /ac",TAMILNADU,TIRUVANNAMALAI,KALASAPAKKAM,2017-12-11T19:42:45.623,
RABI,AGRICULTURE,Cereals,Paddy (Dhan),Nutrient Management,asking about top fertilizer management in paddy,Recommended for apply urea 25 kg + potash 15 kg + neem cake 5 kg + mn mixture 5 kg /ac on 25th and 45 day after transplanting,TAMILNADU,TIRUVANNAMALAI,VANDAVASI,2017-12-11T19:43:44.78,
RABI,AGRICULTURE,Cereals,Paddy (Dhan),Varieties,Asking about suitable paddy season varieties,"Recommended for the season is Navarai (Dec -Jan) ADT 36, ADT 39, ASD 16, ASD 18, MDU 5, CO 47,CORH 3, ADT 43, ADT (R) 45",TAMILNADU,TIRUVANNAMALAI,POLUR,2017-12-11T19:53:52.75,
RABI,HORTICULTURE,Vegetables,Bhindi(Okra/Ladysfinger),Nutrient Management,Asking about sowing season of bhendi,Recommended for the season is Febrauary,TAMILNADU,TIRUVANNAMALAI,CHETPUT,2017-12-11T20:30:01.213,
RABI,HORTICULTURE,Vegetables,Bhindi(Okra/Ladysfinger),Nutrient Management,Asking about basal fertilizer application for bhendi,Recommended for apply urea 30kg + SSP 150kg + Potash 15kg/ac,TAMILNADU,TIRUVANNAMALAI,CHETPUT,2017-12-11T20:45:19.353,
RABI,AGRICULTURE,Cereals,Paddy (Dhan),Seeds,Asking about Rice seeds availability,"Recommended for contact to Tamil Nadu Rice Research Institute Aduthurai, Thanjore phone: 0435-2472108",TAMILNADU,TIRUVANNAMALAI,CHENGAM,2017-12-11T20:53:46.23,
RABI,AGRICULTURE,Others,Others,Weather,Asked about tiruvannamalai weather report information,recommended for today and tommarrow cloudy weather and no possibility of rainfall,TAMILNADU,TIRUVANNAMALAI,CHENGAM,2017-12-11T21:10:03.55,
RABI,AGRICULTURE,Others,Others,Nutrient Management,Asked about Thiruvannamalai today weather Report,Recommended for Thiruvannamalai Today No Rain Fall (0.0 mm),TAMILNADU,TIRUVANNAMALAI,TIRUVANNAMALAI,2017-12-11T21:39:49.09,
RABI,AGRICULTURE,Others,Others,Nutrient Management,Asked about leaf folder management in paddy,Recommended for spray chlorpyrifos 2ml + neem oil + teepol 1ml/lit of water,TAMILNADU,TIRUVANNAMALAI,THANDRAMPET,2017-12-11T21:41:33.487,
RABI,AGRICULTURE,Others,Others,Weather,asking about thiruvannamalai today weather Report,Recommended for thiruvannamalai Today No Rain Fall (0.0 mm),TAMILNADU,TIRUVANNAMALAI,KALASAPAKKAM,2017-12-12T06:23:41.493,
RABI,AGRICULTURE,Oilseeds,Groundnut (pea nut/mung phalli),Nutrient Management,Asking about growth regulators for Groundnut,Recommended for spray groundnut rich 2 kg/ac on Peak flowering and pod development,TAMILNADU,TIRUVANNAMALAI,THELLAR,2017-12-12T08:16:14.09,
RABI,AGRICULTURE,Oilseeds,Groundnut (pea nut/mung phalli),Nutrient Management,Asking about groundnut TNAU foliar application,Recommended for groundnut foliar spray TNAU Groundnut rich 2kg / ac / 200 liter of water,TAMILNADU,TIRUVANNAMALAI,THELLAR,2017-12-12T08:21:39.917,
NA,HORTICULTURE,Vegetables,Lab Lab,Plant Protection,Asking about Pod borer in lab lab,Recommended for spray neem oil 3ml +tepol 1ml / liter of water,TAMILNADU,TIRUVANNAMALAI,POLUR,2017-12-12T08:30:27.033,
NA,AGRICULTURE,Cereals,Paddy (Dhan),Nutrient Management,Asking about paddy fertilizer (MN) management,Recommended for apply paddy micro mixture 5kg / acre,TAMILNADU,TIRUVANNAMALAI,PERNAMALLUR,2017-12-12T08:34:25.263,
RABI,AGRICULTURE,Others,Others,Weather,asking about Thiruvannamalai today weather Report,Recommended for Thiruvannamalai Today No Rain Fall (0.0 mm),TAMILNADU,TIRUVANNAMALAI,THANDRAMPET,2017-12-12T08:34:38.57,
RABI,AGRICULTURE,Fiber Crops,Cotton (Kapas),Sowing Time and Weather,Asking about cotton sowing season and variety,"Recommended for cotton sowing season : February - March and variety : MCU 5, MCU 5 VT, SVPR 2, SVPR 4, Surabhi",TAMILNADU,TIRUVANNAMALAI,PERNAMALLUR,2017-12-12T08:40:26.507,
RABI,AGRICULTURE,Others,Others,Weather,Asking about weather report for thiruvannamalai,recommended for having : partly cloudy weather condition,TAMILNADU,TIRUVANNAMALAI,KEELPENNATHUR,2017-12-12T09:07:08.3,
RABI,AGRICULTURE,Sugar and Starch Crops,Sugarcane (Noble Cane),Varieties,Asking about sugarcane varieties,"Recommended for sugarcane varieties CoC 90063, CoV 92102, Co 86032, CoG 94077, Co Si(Sc)6, Co G (Sc)5, Co C (Sc)22, CoC 24 TNAU SC Si7, TNAU SC Si 8",TAMILNADU,TIRUVANNAMALAI,CHENGAM,2017-12-12T09:20:05.7,
RABI,AGRICULTURE,Oilseeds,Groundnut (pea nut/mung phalli),Weed Management,Asking about weed management for groundnut,Recommended for weed management for groundnut at two hand hoeing and weeding are given on 20th and 40th day after sowing,TAMILNADU,TIRUVANNAMALAI,THELLAR,2017-12-12T09:23:30.59,
RABI,AGRICULTURE,Cereals,Paddy (Dhan),Plant Protection,Asking about stem borer in paddy,Recommended for spray chlorpyriphos 2ml / lit of water,TAMILNADU,TIRUVANNAMALAI,POLUR,2017-12-12T09:23:59.28,
RABI,HORTICULTURE,Flowers,Jasmine,Plant Protection,Asking about bud worm management in Mullai,Recommended for spray profenophos 2ml/lit of water,TAMILNADU,TIRUVANNAMALAI,TIRUVANNAMALAI,2017-12-12T09:27:15.85,
RABI,HORTICULTURE,Vegetables,Watermelon,Nutrient Management,watermelon fruit development,recommended for foliar spray SOP 10gm/lit of water,TAMILNADU,TIRUVANNAMALAI,THURINJAPURAM,2017-12-12T09:32:37.06,
RABI,AGRICULTURE,Cereals,Paddy (Dhan),Seeds,Asking about paddy varieties,"recommended for ADT 36, ADT 39, ASD 16, ASD 18, MDU 5, CO 47,CORH 3, ADT 43, ADT (R) 45",TAMILNADU,TIRUVANNAMALAI,CHETPUT,2017-12-12T10:08:37.487,
RABI,AGRICULTURE,Cereals,Paddy (Dhan),Seeds,Asking about paddy varieties,"recommended for ADT 36, ADT 39, ASD 16, ASD 18, MDU 5, CO 47,CORH 3, ADT 43, ADT (R) 45",TAMILNADU,TIRUVANNAMALAI,CHETPUT,2017-12-12T10:11:01.977,
RABI,AGRICULTURE,Cereals,Paddy (Dhan),Varieties,Asking about Paddy varieties,"Recommended for Paddy varieties ADT 36, ADT 39, ASD 16, ASD 18, MDU 5, CO 47,CORH 3, ADT 43, ADT (R) 45",TAMILNADU,TIRUVANNAMALAI,ARANI,2017-12-12T10:26:49.853,
NA,AGRICULTURE,Others,Others,Weather,asking about Thiruvannamalai today weather Report,Recommended for Thiruvannamalai Today No Rain Fall (0.0 mm),TAMILNADU,TIRUVANNAMALAI,CHETPUT,2017-12-12T10:28:43.54,
RABI,AGRICULTURE,Others,Others,Nutrient Management,top Fertilizer management for paddy,recommended for apply ammonium sulphate 30kg/ac,TAMILNADU,TIRUVANNAMALAI,CHETPUT,2017-12-12T10:34:22.387,
RABI,AGRICULTURE,Cereals,Paddy (Dhan),Plant Protection,Asking about blast in paddy,Recommended for spray Tricyclozole 2gm / litre of water,TAMILNADU,TIRUVANNAMALAI,THANDRAMPET,2017-12-12T10:43:38.633,
RABI,AGRICULTURE,Others,Others,Weather,asking about Thiruvannamalai today weather Report,Recommended for Thiruvannamalai Today No Rain Fall (0.0 mm),TAMILNADU,TIRUVANNAMALAI,CHENGAM,2017-12-12T10:47:37.95,
RABI,AGRICULTURE,Others,Others,Weather,asking about Thiruvannamalai today weather Report,Recommended for Thiruvannamalai Today No Rain Fall (0.0 mm),TAMILNADU,TIRUVANNAMALAI,VANDAVASI,2017-12-12T11:29:04.38,
RABI,HORTICULTURE,Vegetables,Brinjal,Plant Protection,Asking about brinjal fruit borer management,recommended for the spray :Emamectin benzoate 4 gm /tank,TAMILNADU,TIRUVANNAMALAI,CHETPUT,2017-12-12T11:57:23.657,
RABI,AGRICULTURE,Cereals,Paddy (Dhan),Plant Protection,Asking about paddy Leaf folder (or) leaf roller,recommended for the spay : CartapHydrochloride 2gm/lit of water,TAMILNADU,TIRUVANNAMALAI,CHENGAM,2017-12-12T12:05:26.303,
RABI,AGRICULTURE,Others,Others,Weather,asking about Thiruvannamalai today weather Report,Recommended for Thiruvannamalai Today No Rain Fall (0.0 mm),TAMILNADU,TIRUVANNAMALAI,TIRUVANNAMALAI,2017-12-12T12:08:09.267,
RABI,AGRICULTURE,Others,Others,Weather,Asking about Thiruvannamalai today weather Report,Recommended for Thiruvannamalai Today No Rain Fall (0.0 mm),TAMILNADU,TIRUVANNAMALAI,KEELPENNATHUR,2017-12-12T12:09:24.183,
RABI,AGRICULTURE,Others,Others,Weather,Thiruvannamalai today weather Report,Recommended for Thiruvannamalai Today No Rain Fall (0.0 mm),TAMILNADU,TIRUVANNAMALAI,CHEYYAR,2017-12-12T12:32:30.143,
RABI,AGRICULTURE,Cereals,Paddy (Dhan),Nutrient Management,Asking about basal fertilizer management for paddy,Recommended for apply DAP 50 kg + Fym 10 tone + neem cake 10 kg + zinc sulphate 10 kg / ac,TAMILNADU,TIRUVANNAMALAI,VANDAVASI,2017-12-12T12:33:53.703,
RABI,HORTICULTURE,Vegetables,Watermelon,Nutrient Management,Asked about increase fruit quality and size in water melon,recommended for foliar spray potassium sulphate 10gm/lit of water,TAMILNADU,TIRUVANNAMALAI,THURINJAPURAM,2017-12-12T12:51:59.19,
RABI,HORTICULTURE,Vegetables,Brinjal,Market Information,Asking about market rate for brinjal,recommended market rate for brinjal rs. 30/kg,TAMILNADU,TIRUVANNAMALAI,KALASAPAKKAM,2017-12-12T12:52:42.507,
RABI,AGRICULTURE,Sugar and Starch Crops,Sugarcane (Noble Cane),Nutrient Management,Asking about sugarcane trash decompose method,Recommended for spray urea 5gm / lit of water,TAMILNADU,TIRUVANNAMALAI,THANDRAMPET,2017-12-12T12:52:56.953,
RABI,HORTICULTURE,Vegetables,Watermelon,Plant Protection,Asked about increase fruit quality and size in water melon,recommended for foliar spray potassium sulphate 10gm/lit of water,TAMILNADU,TIRUVANNAMALAI,THURINJAPURAM,2017-12-12T12:55:11.943,
RABI,AGRICULTURE,Sugar and Starch Crops,Sugarcane (Noble Cane),Nutrient Management,sugarcane trash decompose method,Recommended for spray urea 10gm / lit of water,TAMILNADU,TIRUVANNAMALAI,THANDRAMPET,2017-12-12T13:00:01.4,
RABI,AGRICULTURE,Cereals,Paddy (Dhan),Varieties,asking about varieties of paddy,"recommended varieties of paddy (Dec -Jan) ADT 36, ADT 39, ASD 16, ASD 18, MDU 5, CO 47,CORH 3, ADT 43, ADT (R) 45",TAMILNADU,TIRUVANNAMALAI,THANDRAMPET,2017-12-12T13:10:59.1,
